{
  "$schema": "./schemas/catalog.schema.json",
  "version": 1,
  "github": {
    "organization": "file-tunnel",
    "repository": "file-tunnel/ftnl-infra",
    "defaultBranch": "main"
  },
  "supabaseOrganization": {
    "id": "pcfljjkfhywmvccntzsy",
    "name": "file-tunnel"
  },
  "canonicalProjectRef": "guxjtokumzopgmrvdemv",
  "projects": [
    {
      "ref": "guxjtokumzopgmrvdemv",
      "target": "guxjtokumzopgmrvdemv/target.json"
    }
  ]
}

